Topics,Top_20_Words
0,view swiftui updat properti bind button code class model variabl set observableobject text publish user app creat tap simpl observ
1,error type combin swift compil code convert publish generic conform protocol method argument paramet understand messag function class figur creat
2,updat object view swiftui pass publish class properti code observ combin variabl notif viewmodel understand declar data assign listen receiv
3,array list data object item swiftui code view display element core store model swift creat save pass string load foreach
4,user combin set code field text input textfield option publish variabl search check type properti true enter swift valid string
5,api respons data json swift decod combin error request code url fetch return success server model swiftui handl imag struct
6,return combin publish function request result network chain method call complet code execut swift async oper flatmap anypublish creat perform
7,xcode app swiftui code io file error project version build crash user beta creat view class firebas devic fine applic
8,combin publish subscrib code swift valu oper sink framework emit event output receiv send complet creat subscript finish cancel expect
9,view swiftui viewmodel method code control model button question bind combin memori manag creat complet navig set project sourc properti
